<?xml version="1.0" encoding="utf-8"?>
<!ELEMENT menu (item+)>
<!ELEMENT item (name, price)>
<!ATTLIST item 
    id CDATA #REQUIRED>
<!ELEMENT  name (#PCDATA)>
<!ELEMENT price (#PCDATA)>